<?xml version="1.0" encoding="UTF-8"?>
<!ELEMENT prenom (#PCDATA)>
<!ELEMENT nom (#PCDATA)>
<!ELEMENT membre ((code, nom, prenom))>
<!ELEMENT liste ((membre+))>
<!ELEMENT code (#PCDATA)>